{
  "t": 1792209600.12,
  "objects": {
    "pill_bottle": {
      "marker": 10,
      "x": 0.18,
      "y": -0.12,
      "yaw": 0.0,
      "h": 0.0826,
      "size": [
        0.0445,
        0.0445
      ],
      "seen": true
    },
    "juice_box": {
      "marker": 11,
      "x": 0.24,
      "y": -0.04,
      "yaw": 0.3,
      "h": 0.0889,
      "size": [
        0.0635,
        0.0318
      ],
      "seen": true
    },
    "tea_tin": {
      "marker": 12,
      "x": 0.15,
      "y": 0.03,
      "yaw": 0.0,
      "h": 0.1016,
      "size": [
        0.0701,
        0.0445
      ],
      "seen": true
    }
  },
  "obstacles": {
    "cereal_box": {
      "marker": 30,
      "x": 0.28,
      "y": 0.07,
      "yaw": 0.0,
      "h": 0.0572,
      "size": [
        0.0699,
        0.0191
      ],
      "seen": true
    }
  },
  "hand": {
    "marker": 40,
    "x": 0.28,
    "y": -0.08,
    "z": 0.03,
    "seen": false
  },
  "zones": {
    "tray": {
      "x": 0.19,
      "y": 0.17,
      "r": 0.09,
      "wall": 0.002,
      "slots": [
        [
          0.13,
          0.15
        ],
        [
          0.22,
          0.12
        ],
        [
          0.2,
          0.22
        ]
      ]
    },
    "handoff": {
      "x": 0.28,
      "y": -0.08,
      "z": 0.1
    }
  }
}
